ref_id,reference,onlink
NJ002,"Drake, Avery A. Jr.,Volkert, Richard, A., Monteverde, Donald H., Herman, Gregory C., Houghton,Hugh F., Parker, Ronald A., and Dalton, Richard F., 1996, Bedrock Geologic Map of Northern New Jersey: U.S. Geological Survey Miscellanenous Investigations Map I-2540-A, scale 1 to 100,000, 4 cross sections, 2 sheets, size 56x40; 58x41.  ",http://pubs.er.usgs.gov/publication/i2540A
NJ030,"Wolfe, J.A., 1976, Stratigraphic distribution of some pollen types from the Campanian and lower Maestrichtian rocks (Upper Cretaceous) of the Middle Atlantic States: U.S. Geological Survey Professional Paper 977, 18 p. ",http://pubs.er.usgs.gov/publication/pp977
NJ034,"Wolfe, J.A., and Pakiser, H.M., 1971, Stratigraphic interpretations of some Cretaceous microfossil floras of the Middle Atlantic States: U.S. Geological Survey Professional Paper 750-B, p. B35-B47. ",http://pubs.er.usgs.gov/publication/pp750B
NJ065,"Drake, A.A., Jr., Kastelic, R.L., Jr., and Lyttle, P.T., 1985, Geologic map of the eastern parts of the Belvidere and Portland Quadrangles, Warren County, New Jersey: U.S. Geological Survey Miscellaneous Investigations Series Map I-1530, scale 1:24,000. ",http://pubs.er.usgs.gov/publication/i1530
NJ079,"Drake, A.A., Jr., and Epstein, J.B., 1967, The Martinsburg Formation (Middle and Upper Ordovician) in the Delaware Valley, Pennsylvania-New Jersey: U.S. Geological Survey Bulletin 1244-H, p.H1-H16. ",http://pubs.er.usgs.gov/publication/b1244H
NJ095,"Owens, J.P., Bybell, L.M., Paulachok, Gary, Ager, T.A., Gonzalez, V.M., and Sugarman, P.J., 1988, Stratigraphy of the Tertiary sediments in a 945-foot-deep corehole near Mays Landing in the southeastern New Jersey Coastal Plain: U.S. Geological Survey Professional Paper 1484, 39 p. ",http://pubs.er.usgs.gov/publication/pp1484
NJ097,"Owens, J.P., and Minard, J.P., 1975, Geologic map of the surficial deposits in the Trenton area, New Jersey and Pennsylvania: U.S. Geological Survey Miscellaneous Investigations Series Map I-884, scale 1:48,000. ",http://pubs.er.usgs.gov/publication/i884
NJ115,"Bybell, L.M., 1992, Calcareous nannofossils; Their use in interpreting Paleocene and Eocene geologic events in the New Jersey Coastal Plain, in Gohn, G.S., ed., Proceedings of the 1988 U.S. Geological Survey Workshop on the Geology and Geohydrology of the Atlantic Coastal Plain: U.S. Geological Survey Circular 1059, p. 9-13. ",http://pubs.er.usgs.gov/publication/cir1059
NJ027,"Olsen, P.E., 1985, Distribution of organic-matter-rich lacustrine rocks in the early Mesozoic Newark Supergroup, in Robinson, G.R., Jr., and Froelich, A.J., eds., Proceedings of the second U.S. Geological Survey workshop on the early Mesozoic basins of the Eastern United States: U.S. Geological Survey Circular 946, p. 61-64. ",http://pubs.er.usgs.gov/publication/cir946
NJ047,"Owens, J.P., and Minard, J.P., 1964b, Pre-Quaternary geology of the Trenton East quadrangle, New Jersey-Pennsylvania: U.S.Geological Survey Geologic Quadrangle Map GQ-341, scale 1:24,000. ",http://pubs.er.usgs.gov/publication/gq341
